{
  "id": "protein-lean-mass-resistance-trained",
  "subject": {
    "type": "compound",
    "id": "protein-complete"
  },
  "outcomeId": "lean_mass",
  "population": {
    "description": "Healthy adults undertaking resistance training, aged 18-70",
    "predicate": {
      "all": [
        {
          "gte": {
            "field": "exerciseFrequencyPerWeek",
            "value": 2
          },
          "label": "trains at least twice a week"
        },
        {
          "contains_any": {
            "field": "exerciseType",
            "values": [
              "resistance_training",
              "mixed",
              "sport_specific"
            ]
          },
          "label": "does resistance or mixed training"
        }
      ]
    }
  },
  "direction": "increases",
  "magnitude": "small_to_moderate",
  "grade": "Strong",
  "gradeRationale": {
    "designs": [
      "meta_analysis_of_rcts",
      "guideline"
    ],
    "consistency": "consistent",
    "directness": "direct",
    "note": "Directness is high but the mechanism matters for how we phrase it: the supplement is a convenience vehicle for total intake, not an independent agent. The user-facing explanation must not imply otherwise."
  },
  "statement": "Protein supplementation increases resistance-training-induced gains in lean mass, with the effect driven by reaching an adequate TOTAL daily protein intake rather than by the supplement being superior to food protein.",
  "citations": [
    {
      "title": "A systematic review, meta-analysis and meta-regression of the effect of protein supplementation on resistance training-induced gains in muscle mass and strength in healthy adults",
      "source": "British Journal of Sports Medicine",
      "year": 2018,
      "url": "https://pubmed.ncbi.nlm.nih.gov/28698222/"
    },
    {
      "title": "International Society of Sports Nutrition Position Stand: protein and exercise",
      "source": "Journal of the International Society of Sports Nutrition",
      "year": 2017,
      "url": "https://pubmed.ncbi.nlm.nih.gov/28642676/"
    }
  ],
  "vectorRefs": [
    "protein-lean-mass-resistance-trained::p_0_a4d5b700a0ed",
    "protein-lean-mass-resistance-trained::p_1_b11d5a0a35e2"
  ],
  "review": {
    "status": "expert_reviewed",
    "reviewedBy": "Jess",
    "reviewedOn": "2026-09-05"
  },
  "version": 1,
  "doseResponse": {
    "summary": "Benefit plateaus at roughly 1.6 g/kg/day of total daily protein; intake beyond that showed no further gain in the meta-regression.",
    "plateau": {
      "amount": 1.6,
      "unit": "g/kg/day"
    }
  }
}
